{"schema":"relatte.dynamic-route-occurrence.experimental/v0","occurrence_id":"field-execution:6d2e109e-217f-4040-b456-2ccd980bc0b8","field_plan_id":"field-plan:bdf31172-13a7-4708-984e-a754e98a7149","field_plan_digest":"sha256:eb70fabdc700540f2947afa799cf0f7256972fa9e5cae94b1f18b260d0718a33","view_digest":"sha256:16ddc34dc447d3b176af69f2fec42235e656fe1f21b1aa27fbe692605180ca33","subject":"visitor","operation_tickets":[{"schema":"relatte.dynamic-operation-ticket.experimental/v0","ticket_id":"ticket:3dc11a8b-66e7-4b8f-82c1-73f8c0feef54","world_id":"world:88a5dc9d62913f13705305796f7018129f70e2743d7bf3f0911cc413efe2c121","head":"sha256:7830b8b95ee60e3da8b96f6c206c0c58d6c24913aa74af8423536029135b00c3","offer_id":"offer:01bfb3e5-4005-492f-985c-9fd05c56aabc","interface_id":"interface:808b5966","grant_id":"grant:5eaba06f-704d-44ab-a2c3-5ed5ab2ecd2d","subject":"visitor","operation":"observe","permission":"observe","at_ms":1000,"use":1,"public_key":"MCowBQYDK2VwAyEAcQgUP18GNcgpyHbmmnlEDtrS/JitcrW/kA2Qf+NkBus=","signature":"4U4T953X/jKWUPrIF29CIBhPwcbMa41fHKY0q8Je8xOaLhOUMj7vjtB/QI0keruHS4+Cp6OCTh+ItkqPsOGQCQ=="},{"schema":"relatte.dynamic-operation-ticket.experimental/v0","ticket_id":"ticket:273c4c36-4d71-4bf0-b765-a9f4ca5dc2ec","world_id":"world:218b8340514975b70f9e0f022292fcb30275e2d9aad9cea252e6fa2520fe69de","head":"sha256:f36d04de1481104d55192345f3cceac953633088cab61fefb0a4da5856c49b59","offer_id":"offer:87e5cd90-6e60-40d2-8963-b414949f0af6","interface_id":"interface:eb1d970e-82b5-4570-acd1-bbeda03222cf","grant_id":"grant:d5089043-f3a3-47f1-aa8f-68f32196ea12","subject":"visitor","operation":"observe","permission":"observe","at_ms":1000,"use":1,"public_key":"MCowBQYDK2VwAyEArA8WsqFg9vHa0Rcc4vtsYIjsstjxb6jYF4G6QiGI9nU=","signature":"PhdrQojH9beAbBX+qtEBF2oCvjbKHzxcjNynHj+aeIYQCvu7wJ3CVSMcZwsgXoeiG4x5R1UXy/B7JF7S0vK3Dg=="}],"lifecycle_residuals":[],"failures":[],"nested":[],"execution":{"schema":"relatte.route-execution.experimental/v0","execution_id":"execution:c6214801-dff5-427b-b67a-41fc9ffe3e33","route_id":"route:4591e7b35a47a29124957cd9ebcf58562de3775a1f56fef0dc9e6b00db2b6505","plan_digest":"sha256:a5c49578437b2e2d52854e0c4db1878af0be1b938168ef4febf89dbace9ca59f","actual_interfaces_traversed":["interface:808b5966","interface:eb1d970e-82b5-4570-acd1-bbeda03222cf"],"actual_relation_receipts":[{"receipt_id":"relation-receipt:4aba9231-c671-4fdb-8041-d22415dd080f","execution_id":"execution:c6214801-dff5-427b-b67a-41fc9ffe3e33","relation_id":"relation:ed44b3fa-c88f-4e76-aac9-d3d277a9cb2c","source_interface":"interface:808b5966","destination_interface":"interface:eb1d970e-82b5-4570-acd1-bbeda03222cf","source_particular":"particular:ba270fe5-c66b-4ffc-bc9c-2991ebd1a7f3","descendant_particular":"particular:9bbcdeae-98d0-4200-a0be-a37564e3333e","input_digest":"sha256:a5d95ecd623c9b2a7461b862f97d0cd992de760ce921e26abd18fc058cb5cb06","output_digest":"sha256:a5d95ecd623c9b2a7461b862f97d0cd992de760ce921e26abd18fc058cb5cb06","native_ref":"fs:dev:33:ino:8225:artifact.bin","evidence":{"facts":["ordered"],"native":{"path_scope":"local","regular_file":true,"device":"33","inode":"8225","identity_model":"local file object + bytes","filesystem_content_sha256":"a5d95ecd623c9b2a7461b862f97d0cd992de760ce921e26abd18fc058cb5cb06","runtime_observation_ref":"sha256:3f8481194f761c457e43de1dda97771eca0e29ab2435a8e08179b3c74a0d90ce","semantic":"MAP-FRAGMENT-OBSERVATION-DOOR","observation":{"map_fragment":{"destination":"ROOM B"}},"state_digest":"sha256:040cfae34b783a86f5e0307cabfd9e1ba2fc16eec7e377ecbf54d39d4fc56fd9"},"dynamic_gate":{"schema":"relatte.dynamic-operation-ticket.experimental/v0","ticket_id":"ticket:273c4c36-4d71-4bf0-b765-a9f4ca5dc2ec","world_id":"world:218b8340514975b70f9e0f022292fcb30275e2d9aad9cea252e6fa2520fe69de","head":"sha256:f36d04de1481104d55192345f3cceac953633088cab61fefb0a4da5856c49b59","offer_id":"offer:87e5cd90-6e60-40d2-8963-b414949f0af6","interface_id":"interface:eb1d970e-82b5-4570-acd1-bbeda03222cf","grant_id":"grant:d5089043-f3a3-47f1-aa8f-68f32196ea12","subject":"visitor","operation":"observe","permission":"observe","at_ms":1000,"use":1,"public_key":"MCowBQYDK2VwAyEArA8WsqFg9vHa0Rcc4vtsYIjsstjxb6jYF4G6QiGI9nU=","signature":"PhdrQojH9beAbBX+qtEBF2oCvjbKHzxcjNynHj+aeIYQCvu7wJ3CVSMcZwsgXoeiG4x5R1UXy/B7JF7S0vK3Dg=="}},"verification_ref":"verification:2c268110","receipt_digest":"sha256:20ad41e3780f9db698e1b0bedfa9f1b12dea54a1289ffec50d1583f2d52de473"}],"native_particular_refs":["source:095dc28f-c073-4d17-b085-b0eeb6c7c904","fs:dev:33:ino:8225:artifact.bin"],"crossing_refs":[],"result":"succeeded","residuals":[],"failures":[],"source":{"particular_id":"particular:ba270fe5-c66b-4ffc-bc9c-2991ebd1a7f3","interface_id":"interface:808b5966","parent":null,"content_digest":"sha256:a5d95ecd623c9b2a7461b862f97d0cd992de760ce921e26abd18fc058cb5cb06","native_ref":"source:095dc28f-c073-4d17-b085-b0eeb6c7c904","authority":[],"transformation":null},"particulars":[{"particular_id":"particular:9bbcdeae-98d0-4200-a0be-a37564e3333e","interface_id":"interface:eb1d970e-82b5-4570-acd1-bbeda03222cf","parent":"particular:ba270fe5-c66b-4ffc-bc9c-2991ebd1a7f3","content_digest":"sha256:a5d95ecd623c9b2a7461b862f97d0cd992de760ce921e26abd18fc058cb5cb06","native_ref":"fs:dev:33:ino:8225:artifact.bin","authority":[],"transformation":{"relation_id":"relation:ed44b3fa-c88f-4e76-aac9-d3d277a9cb2c","reversible":true,"preserves":{"bytes":true,"semantics":true,"ancestry":true,"order":true,"timing":false,"particular_identity":false},"may_lose":[]}}],"execution_digest":"sha256:e3aad33f36845d00912da6a317d72c3ac649770825961bdce6eff5fda1e21cd2"},"result":"succeeded","dynamic_execution_digest":"sha256:3f285eab24ac583a38b8daa5a97c83856eec7429364a8d48439405dfc2549049"}