{"schema":"relatte.dynamic-route-occurrence.experimental/v0","occurrence_id":"field-execution:fee96466-aa86-4f1c-a673-bdd45a718218","field_plan_id":"field-plan:ae3d5f2f-2926-4c14-85bd-a9165544f5f1","field_plan_digest":"sha256:92e144ef009014164f4f81c0c7485dd330c6836290f44821a093fd49c91c9a95","view_digest":"sha256:26d4b3cad559949851275a755c1e305e5c5634e266985c82d94c9d84fad7dcff","subject":"visitor","operation_tickets":[{"schema":"relatte.dynamic-operation-ticket.experimental/v0","ticket_id":"ticket:57a624af-d04d-45d9-a7d9-30e14a3702c4","world_id":"world:88a5dc9d62913f13705305796f7018129f70e2743d7bf3f0911cc413efe2c121","head":"sha256:7830b8b95ee60e3da8b96f6c206c0c58d6c24913aa74af8423536029135b00c3","offer_id":"offer:01bfb3e5-4005-492f-985c-9fd05c56aabc","interface_id":"interface:808b5966","grant_id":"grant:7b3b5cca-2af7-40fb-aec5-0633c9d1d19b","subject":"visitor","operation":"observe","permission":"observe","at_ms":1000,"use":2,"public_key":"MCowBQYDK2VwAyEAcQgUP18GNcgpyHbmmnlEDtrS/JitcrW/kA2Qf+NkBus=","signature":"Iu++KTi2tj2tCrWg5OtzBeOpB48I1O8h2nV+PAjUwxuNba9n7xNgHhw97dOOtnRzUjmPIc7DlxT9H9zC65xdAw=="}],"lifecycle_residuals":[],"failures":[{"at_interface":"interface:808b5966","after_relations":0,"reason":"GRANT_ABSENT"}],"nested":[],"execution":{"schema":"relatte.route-execution.experimental/v0","execution_id":"execution:77966947-f22b-4e44-8222-b7c492d3b7ea","route_id":"route:a0732c0822e12b3543b951b6a5d9ce866d0001092eba43979cf60fe913b7cdfe","plan_digest":"sha256:9f7c61089d81aaae3428e9f557418516896082faf1b8e82efbec74404adc00e4","actual_interfaces_traversed":["interface:808b5966"],"actual_relation_receipts":[],"native_particular_refs":["source:72d9873c-b910-4602-9f6b-065f690052f8"],"crossing_refs":[],"result":"failed","residuals":[],"failures":[{"at_interface":"interface:808b5966","after_relations":0,"reason":"GRANT_ABSENT"}],"source":{"particular_id":"particular:c3ebcb8d-57ad-4add-b354-2a430ee5cc9e","interface_id":"interface:808b5966","parent":null,"content_digest":"sha256:a5d95ecd623c9b2a7461b862f97d0cd992de760ce921e26abd18fc058cb5cb06","native_ref":"source:72d9873c-b910-4602-9f6b-065f690052f8","authority":[],"transformation":null},"particulars":[],"execution_digest":"sha256:4cf871ab81051fa7b8935968079d39042ec49600596b731a153a742ff47a0744"},"result":"failed","dynamic_execution_digest":"sha256:76d88c1b2c848e3b5413c1e8a9d8daa9b4f85f3c178b79c76240fa97ce8be65f"}