{"schema":"relatte.dynamic-route-occurrence.experimental/v0","occurrence_id":"field-execution:87789f4f-b530-4510-96d3-173237f971de","field_plan_id":"field-plan:1d721a33-fb67-4e36-abab-f0672176c326","field_plan_digest":"sha256:54e7241f7c96f93c88c627bfdb09b557ff61cdaa88ad9b405764e374e20378ee","view_digest":"sha256:7e0433f3b2c2c3dc851d5b826293896d9112cfa4d388c9390b6c2f753858bed7","subject":"visitor","operation_tickets":[{"schema":"relatte.dynamic-operation-ticket.experimental/v0","ticket_id":"ticket:fa841f0d-1382-4ce1-9dce-cf7fd09c92f6","world_id":"world:88a5dc9d62913f13705305796f7018129f70e2743d7bf3f0911cc413efe2c121","head":"sha256:04e5360f80ad0abcef11a24bd140dc25a702a4c53840d5fb6a6f79157ded8a98","offer_id":"offer:01bfb3e5-4005-492f-985c-9fd05c56aabc","interface_id":"interface:808b5966","grant_id":"grant:7b3b5cca-2af7-40fb-aec5-0633c9d1d19b","subject":"visitor","operation":"observe","permission":"observe","at_ms":1000,"use":1,"public_key":"MCowBQYDK2VwAyEAcQgUP18GNcgpyHbmmnlEDtrS/JitcrW/kA2Qf+NkBus=","signature":"FYy5hLIlhRGY7TNsqFibL2zc+jccoKIMU+SJTKrzbiaBLEjOz15xAQI09bzEdAnu7nRRorrWPizhAHrkLsi7CQ=="},{"schema":"relatte.dynamic-operation-ticket.experimental/v0","ticket_id":"ticket:07a7643b-7416-4763-95cc-3bbaf63216ee","world_id":"world:218b8340514975b70f9e0f022292fcb30275e2d9aad9cea252e6fa2520fe69de","head":"sha256:35f9572478f0ca90c4f326106f4e40dafb378c0b6510c5e1b60173864288c5ea","offer_id":"offer:720aa418-f84e-4b60-bc38-c3ccaaa85c28","interface_id":"interface:552dd703-9534-4075-a884-33125591fc50","grant_id":"grant:ac79648e-c5e0-43f4-8fb2-5dd7c459aae9","subject":"visitor","operation":"observe","permission":"observe","at_ms":1000,"use":1,"public_key":"MCowBQYDK2VwAyEArA8WsqFg9vHa0Rcc4vtsYIjsstjxb6jYF4G6QiGI9nU=","signature":"Dkg/PIiBjiDWbFPyW6716o5vnNvTxvTL3Olu08tl36g7MUQkIUBj/wguWExqlMq9ZONwI5ZuvZdADr58DznTCA=="}],"lifecycle_residuals":[],"failures":[],"nested":[],"execution":{"schema":"relatte.route-execution.experimental/v0","execution_id":"execution:11b21661-a8bc-4b46-8688-b9f2fd9ece2c","route_id":"route:8370de2e207343bf0b65ad94b0f09c1c54a7362fd1277fd70669c6d378d5aec7","plan_digest":"sha256:f5f99b5a6eddbc54c9df4195dae2970a4732747c75ad1896f6a5da6b0ffc0df0","actual_interfaces_traversed":["interface:808b5966","interface:552dd703-9534-4075-a884-33125591fc50"],"actual_relation_receipts":[{"receipt_id":"relation-receipt:6dd09297-5082-409e-b567-17b89869b837","execution_id":"execution:11b21661-a8bc-4b46-8688-b9f2fd9ece2c","relation_id":"relation:986e798e-a8ad-4977-aea4-986531f78ecc","source_interface":"interface:808b5966","destination_interface":"interface:552dd703-9534-4075-a884-33125591fc50","source_particular":"particular:ba37375d-929a-4797-9be6-847e0ac90c18","descendant_particular":"particular:9dd0ea21-e0c1-4ec2-a940-108b3a490364","input_digest":"sha256:a5d95ecd623c9b2a7461b862f97d0cd992de760ce921e26abd18fc058cb5cb06","output_digest":"sha256:a5d95ecd623c9b2a7461b862f97d0cd992de760ce921e26abd18fc058cb5cb06","native_ref":"fs:dev:33:ino:8223:artifact.bin","evidence":{"facts":["ordered"],"native":{"path_scope":"local","regular_file":true,"device":"33","inode":"8223","identity_model":"local file object + bytes","filesystem_content_sha256":"a5d95ecd623c9b2a7461b862f97d0cd992de760ce921e26abd18fc058cb5cb06","runtime_observation_ref":"sha256:11325f1db83f584c88efcd86440f4ea148e82324b5649111e18fac1e4b7bb8af","semantic":"CHEST-OBSERVATION-DOOR","observation":{"contents":["stone","map fragment"]},"state_digest":"sha256:24779a3665ce238804dd92fa701f2e71d92b8d11f2fef63b5f7161ddc49e4ba0"},"dynamic_gate":{"schema":"relatte.dynamic-operation-ticket.experimental/v0","ticket_id":"ticket:07a7643b-7416-4763-95cc-3bbaf63216ee","world_id":"world:218b8340514975b70f9e0f022292fcb30275e2d9aad9cea252e6fa2520fe69de","head":"sha256:35f9572478f0ca90c4f326106f4e40dafb378c0b6510c5e1b60173864288c5ea","offer_id":"offer:720aa418-f84e-4b60-bc38-c3ccaaa85c28","interface_id":"interface:552dd703-9534-4075-a884-33125591fc50","grant_id":"grant:ac79648e-c5e0-43f4-8fb2-5dd7c459aae9","subject":"visitor","operation":"observe","permission":"observe","at_ms":1000,"use":1,"public_key":"MCowBQYDK2VwAyEArA8WsqFg9vHa0Rcc4vtsYIjsstjxb6jYF4G6QiGI9nU=","signature":"Dkg/PIiBjiDWbFPyW6716o5vnNvTxvTL3Olu08tl36g7MUQkIUBj/wguWExqlMq9ZONwI5ZuvZdADr58DznTCA=="}},"verification_ref":"verification:2c268110","receipt_digest":"sha256:7523fad0b9510048e782e5d1cbbc94746f27198f3d6692ee329b082e37361852"}],"native_particular_refs":["source:2368bfcc-4d5c-48b3-8038-cc6687c232b5","fs:dev:33:ino:8223:artifact.bin"],"crossing_refs":[],"result":"succeeded","residuals":[],"failures":[],"source":{"particular_id":"particular:ba37375d-929a-4797-9be6-847e0ac90c18","interface_id":"interface:808b5966","parent":null,"content_digest":"sha256:a5d95ecd623c9b2a7461b862f97d0cd992de760ce921e26abd18fc058cb5cb06","native_ref":"source:2368bfcc-4d5c-48b3-8038-cc6687c232b5","authority":[],"transformation":null},"particulars":[{"particular_id":"particular:9dd0ea21-e0c1-4ec2-a940-108b3a490364","interface_id":"interface:552dd703-9534-4075-a884-33125591fc50","parent":"particular:ba37375d-929a-4797-9be6-847e0ac90c18","content_digest":"sha256:a5d95ecd623c9b2a7461b862f97d0cd992de760ce921e26abd18fc058cb5cb06","native_ref":"fs:dev:33:ino:8223:artifact.bin","authority":[],"transformation":{"relation_id":"relation:986e798e-a8ad-4977-aea4-986531f78ecc","reversible":true,"preserves":{"bytes":true,"semantics":true,"ancestry":true,"order":true,"timing":false,"particular_identity":false},"may_lose":[]}}],"execution_digest":"sha256:af20998392fb847d2008a7dcf1534c5c4ef2f4f89032691cb05f8cc93952c792"},"result":"succeeded","dynamic_execution_digest":"sha256:51214daa8384b33c921ec193617a5c468554c1c64c4906065c397b3647c6f0c7"}