{"schema":"relatte.dynamic-route-occurrence.experimental/v0","occurrence_id":"field-execution:af8dbdc6-d4e5-4669-9a45-1370205a5ab0","field_plan_id":"field-plan:1d721a33-fb67-4e36-abab-f0672176c326","field_plan_digest":"sha256:54e7241f7c96f93c88c627bfdb09b557ff61cdaa88ad9b405764e374e20378ee","view_digest":"sha256:7e0433f3b2c2c3dc851d5b826293896d9112cfa4d388c9390b6c2f753858bed7","subject":"visitor","operation_tickets":[],"lifecycle_residuals":[],"failures":[{"reason":"TERMINAL_INSTANCE_DEATH"}],"nested":[],"execution":null,"result":"failed","dynamic_execution_digest":"sha256:05ab3dc6402e3e3427e684c26f9a286e263d4ec032364e26fe5c0066b3ed2c92"}