{"schema":"relatte.dynamic-route-occurrence.experimental/v0","occurrence_id":"field-execution:67bba8fa-2bc3-4514-8ea4-f12a17cef77d","field_plan_id":"field-plan:ae3d5f2f-2926-4c14-85bd-a9165544f5f1","field_plan_digest":"sha256:92e144ef009014164f4f81c0c7485dd330c6836290f44821a093fd49c91c9a95","view_digest":"sha256:26d4b3cad559949851275a755c1e305e5c5634e266985c82d94c9d84fad7dcff","subject":"visitor","operation_tickets":[{"schema":"relatte.dynamic-operation-ticket.experimental/v0","ticket_id":"ticket:04e185ec-24e6-47b8-b429-c3aa3d88fed8","world_id":"world:88a5dc9d62913f13705305796f7018129f70e2743d7bf3f0911cc413efe2c121","head":"sha256:b7061a2ac7049cf71dc61e08d76c34f36aa6f26952126641ad9385696cb05bd9","offer_id":"offer:01bfb3e5-4005-492f-985c-9fd05c56aabc","interface_id":"interface:808b5966","grant_id":"grant:1b9c086c-75d7-4ff4-a0f7-f71d6a58ecbb","subject":"visitor","operation":"observe","permission":"observe","at_ms":1000,"use":1,"public_key":"MCowBQYDK2VwAyEAcQgUP18GNcgpyHbmmnlEDtrS/JitcrW/kA2Qf+NkBus=","signature":"+dIbPB1LY/4AgPDnVi1RqXKukCU+WwfPa5+My7XaebH8goqFMhvZwbVAVfha0Q5+gT6HF5xbypjHRGkA/05sDw=="},{"schema":"relatte.dynamic-operation-ticket.experimental/v0","ticket_id":"ticket:2623d988-1f01-400b-95ff-4d7ee1b32d9a","world_id":"world:6506087b58a232047c933cc203523f89e59171c75add4687fccc13af703e585b","head":"sha256:462959fc42436048f9adbc9353063175515d34efbf2a6d8eb115b9e92ea5902c","offer_id":"offer:1841a5ed-be19-459b-b484-5c501f2f5f97","interface_id":"interface:552dd703-9534-4075-a884-33125591fc50","grant_id":"grant:1f30342c-790a-4718-9f89-4098d7a7705f","subject":"visitor","operation":"observe","permission":"observe","at_ms":1000,"use":1,"public_key":"MCowBQYDK2VwAyEAGBQavc3w0tye1QLG1aPPDfsI3Mx6zyAJ3FCUspFiRN0=","signature":"o3eHVEb8e5CWNV7WF305BR6PdWveIe7PTeUmQFqqh8yNhFr6HVZiJXM9a1nmROMohABSHH3tfLMzT1qCSO+5Bg=="}],"lifecycle_residuals":[],"failures":[],"nested":[],"execution":{"schema":"relatte.route-execution.experimental/v0","execution_id":"execution:569c695b-c5ef-45db-9541-5f6bfd739d48","route_id":"route:a0732c0822e12b3543b951b6a5d9ce866d0001092eba43979cf60fe913b7cdfe","plan_digest":"sha256:9f7c61089d81aaae3428e9f557418516896082faf1b8e82efbec74404adc00e4","actual_interfaces_traversed":["interface:808b5966","interface:552dd703-9534-4075-a884-33125591fc50"],"actual_relation_receipts":[{"receipt_id":"relation-receipt:69bac12d-9569-4ce8-8313-3568199f5c9b","execution_id":"execution:569c695b-c5ef-45db-9541-5f6bfd739d48","relation_id":"relation:6dbca995-b600-4275-bdda-404390808f12","source_interface":"interface:808b5966","destination_interface":"interface:552dd703-9534-4075-a884-33125591fc50","source_particular":"particular:c3ebcb8d-57ad-4add-b354-2a430ee5cc9e","descendant_particular":"particular:f976bfdc-07ae-4e92-b037-708127bf365d","input_digest":"sha256:a5d95ecd623c9b2a7461b862f97d0cd992de760ce921e26abd18fc058cb5cb06","output_digest":"sha256:a5d95ecd623c9b2a7461b862f97d0cd992de760ce921e26abd18fc058cb5cb06","native_ref":"fs:dev:33:ino:8227:artifact.bin","evidence":{"facts":["ordered"],"native":{"path_scope":"local","regular_file":true,"device":"33","inode":"8227","identity_model":"local file object + bytes","filesystem_content_sha256":"a5d95ecd623c9b2a7461b862f97d0cd992de760ce921e26abd18fc058cb5cb06","runtime_observation_ref":"sha256:96a1bccec61eb39897467fcabab994fc4c9eb63903df86274ba129d9c66501e4","semantic":"CHEST-OBSERVATION-DOOR","observation":{"contents":["stone","map fragment"]},"state_digest":"sha256:51f1d960ec09741a08d345dc8d6d75581fa30540dd02efabc74a65d8011c6a57"},"dynamic_gate":{"schema":"relatte.dynamic-operation-ticket.experimental/v0","ticket_id":"ticket:2623d988-1f01-400b-95ff-4d7ee1b32d9a","world_id":"world:6506087b58a232047c933cc203523f89e59171c75add4687fccc13af703e585b","head":"sha256:462959fc42436048f9adbc9353063175515d34efbf2a6d8eb115b9e92ea5902c","offer_id":"offer:1841a5ed-be19-459b-b484-5c501f2f5f97","interface_id":"interface:552dd703-9534-4075-a884-33125591fc50","grant_id":"grant:1f30342c-790a-4718-9f89-4098d7a7705f","subject":"visitor","operation":"observe","permission":"observe","at_ms":1000,"use":1,"public_key":"MCowBQYDK2VwAyEAGBQavc3w0tye1QLG1aPPDfsI3Mx6zyAJ3FCUspFiRN0=","signature":"o3eHVEb8e5CWNV7WF305BR6PdWveIe7PTeUmQFqqh8yNhFr6HVZiJXM9a1nmROMohABSHH3tfLMzT1qCSO+5Bg=="}},"verification_ref":"verification:2c268110","receipt_digest":"sha256:9326bc1b92ea548a92438ee521a86f63ffe2db17a0d599b858ab0419130465ce"}],"native_particular_refs":["source:72d9873c-b910-4602-9f6b-065f690052f8","fs:dev:33:ino:8227:artifact.bin"],"crossing_refs":[],"result":"succeeded","residuals":[],"failures":[],"source":{"particular_id":"particular:c3ebcb8d-57ad-4add-b354-2a430ee5cc9e","interface_id":"interface:808b5966","parent":null,"content_digest":"sha256:a5d95ecd623c9b2a7461b862f97d0cd992de760ce921e26abd18fc058cb5cb06","native_ref":"source:72d9873c-b910-4602-9f6b-065f690052f8","authority":[],"transformation":null},"particulars":[{"particular_id":"particular:f976bfdc-07ae-4e92-b037-708127bf365d","interface_id":"interface:552dd703-9534-4075-a884-33125591fc50","parent":"particular:c3ebcb8d-57ad-4add-b354-2a430ee5cc9e","content_digest":"sha256:a5d95ecd623c9b2a7461b862f97d0cd992de760ce921e26abd18fc058cb5cb06","native_ref":"fs:dev:33:ino:8227:artifact.bin","authority":[],"transformation":{"relation_id":"relation:6dbca995-b600-4275-bdda-404390808f12","reversible":true,"preserves":{"bytes":true,"semantics":true,"ancestry":true,"order":true,"timing":false,"particular_identity":false},"may_lose":[]}}],"execution_digest":"sha256:77a5a94323fabae1918e11bca72b60ed65b43bd3f8b5da03ed2f2c8fc39984ab"},"result":"succeeded","dynamic_execution_digest":"sha256:b01c42ebccf154fc34be5bd842e90ef1742459c6a8d5c3ab12632f67fc10f25f"}